{
  "schema_version": 1,
  "relation_id": "11111111-1111-4111-8111-000000000001",
  "observation_id": "11111111-1111-4111-8111-000000000002",
  "flight_id": "11111111-1111-4111-8111-000000000003",
  "subject_track_id": "track:flightA:person12",
  "object_track_id": "track:flightA:excavator3",
  "subject_class": "person",
  "object_class": "excavator",
  "metric_status": "SHADOW_ESTIMATE",
  "geometry_level": "GEO_ESTIMATE",
  "distance_m": 4.2,
  "distance_interval_m": null,
  "distance_basis": "GROUND_FOOTPRINT",
  "quality_reasons": [
    "GT_NOT_YET_VALIDATED"
  ],
  "frame_ref": {
    "edge_boot_id": "11111111-1111-4111-8111-000000000004",
    "edge_frame_seq": 1920,
    "lens_id": "wide",
    "time_basis": "PSDK_LOCAL_RECEIVE"
  },
  "calibration_revision_id": "cal-2026-10-experiment",
  "ground_model_revision_id": "ground-plane-unverified",
  "effective_policy_revision_id": "11111111-1111-4111-8111-000000000005",
  "person_ground_point_enu_m": [
    28.5,
    16.7
  ],
  "equipment_footprint_enu_m": [
    [
      32.1,
      15.1
    ],
    [
      33.8,
      15.1
    ],
    [
      33.8,
      17.9
    ],
    [
      32.1,
      17.9
    ]
  ]
}
